{
  "schemaVersion": 1, "id": "dreamcast-gamepad", "revision": 1, "label": "Controle Dreamcast",
  "platforms": ["dreamcast"], "source": {"kind": "builtin", "license": "GPL-3.0-or-later"},
  "layout": "standard-gamepad", "maxPlayers": 4,
  "bindings": [
    {"action": "game.up", "input": "hat.up", "required": true}, {"action": "game.right", "input": "hat.right", "required": true},
    {"action": "game.down", "input": "hat.down", "required": true}, {"action": "game.left", "input": "hat.left", "required": true},
    {"action": "game.primary", "input": "button.south", "required": true}, {"action": "game.secondary", "input": "button.east", "required": true},
    {"action": "game.tertiary", "input": "button.west", "required": true}, {"action": "game.quaternary", "input": "button.north", "required": true},
    {"action": "game.start", "input": "button.start", "required": true}, {"action": "game.axis-x", "input": "axis.left-x", "required": true},
    {"action": "game.axis-y", "input": "axis.left-y", "required": true}
  ],
  "rotation": {"allowedOrientations": ["landscape"], "defaultOrientation": "landscape", "directionalRemap": "preserve"}
}
